,title,link,author,author_link,date
432,The effects of sodium bicarbonate supplementation on a soccer specific conditioning test in division III soccer players,https://pureportal.coventry.ac.uk/en/publications/the-effects-of-sodium-bicarbonate-supplementation-on-a-soccer-spe,"Guimarães-Ferreira, L.",https://pureportal.coventry.ac.uk/en/persons/lucas-guimaraes-ferreira-2,2015
433,The Impact of a 24-h Ultra-Marathon on Circulatory Endotoxin and Cytokine Profile,https://pureportal.coventry.ac.uk/en/publications/the-impact-of-a-24-h-ultra-marathon-on-circulatory-endotoxin-and--2,"Hankey, J.",https://pureportal.coventry.ac.uk/en/persons/jo-hankey,2015
434,The impact of a school-based gardening intervention on intentions and behaviour related to fruit and vegetable consumption in children,https://pureportal.coventry.ac.uk/en/publications/the-impact-of-a-school-based-gardening-intervention-on-intentions-2,"Duncan, M. J.",https://pureportal.coventry.ac.uk/en/persons/michael-duncan,1 Jun 2015
435,Towards understanding the contribution of seat heating and cooling to occupant thermal sensation and comfort: some methodological considerations,https://pureportal.coventry.ac.uk/en/publications/towards-understanding-the-contribution-of-seat-heating-and-coolin-2,"Thake, D.",https://pureportal.coventry.ac.uk/en/persons/doug-thake,2015
436,Ultrasound-assisted selective hydrogenation of C-5 acetylene alcohols with Lindlar catalysts,https://pureportal.coventry.ac.uk/en/publications/ultrasound-assisted-selective-hydrogenation-of-c-5-acetylene-alco-2,,,Sep 2015
437,Urinary Volatile Organic Compounds for the Detection of Prostate Cancer,https://pureportal.coventry.ac.uk/en/publications/urinary-volatile-organic-compounds-for-the-detection-of-prostate--2,,,24 Nov 2015
438,What can isolated skeletal muscle experiments tell us about the effects of caffeine on exercise performance?,https://pureportal.coventry.ac.uk/en/publications/what-can-isolated-skeletal-muscle-experiments-tell-us-about-the-e-2,"Tallis, J.",https://pureportal.coventry.ac.uk/en/persons/jason-tallis,2015
439,Antimicrobial treatment improves mycobacterial survival in nonpermissive growth conditions,https://pureportal.coventry.ac.uk/en/publications/antimicrobial-treatment-improves-mycobacterial-survival-in-nonper,"Burke, B.",https://pureportal.coventry.ac.uk/en/persons/bernie-burke,May 2014
440,Application of Ultrasound,https://pureportal.coventry.ac.uk/en/publications/application-of-ultrasound-2,,,21 Aug 2014
441,Assessing the effects of exposure to environmental stress on some functional properties of Bifidobacterium animalis ssp. lactis,https://pureportal.coventry.ac.uk/en/publications/assessing-the-effects-of-exposure-to-environmental-stress-on-some-2,"Amund, D.",https://pureportal.coventry.ac.uk/en/persons/daniel-amund,2014
442,Caspase inhibition via A3 adenosine receptors: A new cardioprotective mechanism against myocardial infarction,https://pureportal.coventry.ac.uk/en/publications/caspase-inhibition-via-a3-adenosine-receptors-a-new-cardioprotect-2,"Maddock, H. L.",https://pureportal.coventry.ac.uk/en/persons/helen-maddock,Feb 2014
443,Combined Triaxial Accelerometry and Heart Rate Telemetry for the Physiological Characterization of Latin Dance in Non-Professional Adults,https://pureportal.coventry.ac.uk/en/publications/combined-triaxial-accelerometry-and-heart-rate-telemetry-for-the-,"Domene, P. A.",https://pureportal.coventry.ac.uk/en/persons/pablo-domene,1 Mar 2014
444,Efeito da ingestão de cafeína sobre o desempenho no treinamento de força,https://pureportal.coventry.ac.uk/en/publications/effect-of-caffeine-ingestion-on-resistance-training-performance,"Guimarães Ferreira, L.",https://pureportal.coventry.ac.uk/en/persons/lucas-guimaraes-ferreira-2,1 Mar 2014
445,Effects of exercise intensity on perceived exertion during multiple sets of bench press to volitional failure,https://pureportal.coventry.ac.uk/en/publications/effects-of-exercise-intensity-on-perceived-exertion-during-multip,"Duncan, M. J.",https://pureportal.coventry.ac.uk/en/persons/michael-duncan,2014
446,Fibril formation from pea protein and subsequent gel formation,https://pureportal.coventry.ac.uk/en/publications/fibril-formation-from-pea-protein-and-subsequent-gel-formation,"Munialo, C. D.",https://pureportal.coventry.ac.uk/en/persons/claire-munialo,19 Mar 2014
447,Love builds episode 4,https://pureportal.coventry.ac.uk/en/publications/love-builds-episode-4-2,"Lund, P.",https://pureportal.coventry.ac.uk/en/persons/patricia-lund,2014
448,Modification of ovalbumin with fructooligosaccharides: Consequences for network morphology and mechanical deformation responses,https://pureportal.coventry.ac.uk/en/publications/modification-of-ovalbumin-with-fructooligosaccharides-consequence,"Munialo, C. D.",https://pureportal.coventry.ac.uk/en/persons/claire-munialo,25 Nov 2014
449,Perturbed energy balance and hydration status in ultra-endurance runners during a 24 h ultra-marathon,https://pureportal.coventry.ac.uk/en/publications/perturbed-energy-balance-and-hydration-status-in-ultra-endurance--3,"Hankey, J.",https://pureportal.coventry.ac.uk/en/persons/jo-hankey,Aug 2014
450,Physical activity in patients with chronic obstructive pulmonary disease.,https://pureportal.coventry.ac.uk/en/publications/physical-activity-in-patients-with-chronic-obstructive-pulmonary-,"Horton, E.",https://pureportal.coventry.ac.uk/en/persons/elizabeth-horton,2014
451,Physiological and Perceptual Responses to Latin Partnered Social Dance,https://pureportal.coventry.ac.uk/en/publications/physiological-and-perceptual-responses-to-latin-partnered-social-,"Domene, P. A.",https://pureportal.coventry.ac.uk/en/persons/pablo-domene,1 Oct 2014
452,Results of the SPACE FOR COPD programme in comparison to pulmonary rehabilitation programme at 6 months,https://pureportal.coventry.ac.uk/en/publications/results-of-the-space-for-copd-programme-in-comparison-to-pulmonar,"Horton, E.",https://pureportal.coventry.ac.uk/en/persons/elizabeth-horton,2014
453,The ability to store energy in pea protein gels is set by network dimensions smaller than 50nm,https://pureportal.coventry.ac.uk/en/publications/the-ability-to-store-energy-in-pea-protein-gels-is-set-by-network,"Munialo, C. D.",https://pureportal.coventry.ac.uk/en/persons/claire-munialo,Oct 2014
454,The Impact of a 24-h Ultra-Marathon on Salivary Antimicrobial Protein Responses,https://pureportal.coventry.ac.uk/en/publications/the-impact-of-a-24-h-ultra-marathon-on-salivary-antimicrobial-pro-2,"Hankey, J.",https://pureportal.coventry.ac.uk/en/persons/jo-hankey,Oct 2014
455,The regulatory roles of phosphatases in cancer,https://pureportal.coventry.ac.uk/en/publications/the-regulatory-roles-of-phosphatases-in-cancer-2,,,20 Jan 2014
456,Use of freely available and open source tools for in silico screening in chemical biology,https://pureportal.coventry.ac.uk/en/publications/use-of-freely-available-and-open-source-tools-for-in-silico-scree,"Gould, P. S.",https://pureportal.coventry.ac.uk/en/persons/phillip-gould,8 Apr 2014
457,Weight loss in a UK commercial all meal provision study: A randomised controlled trial,https://pureportal.coventry.ac.uk/en/publications/weight-loss-in-a-uk-commercial-all-meal-provision-study-a-randomi,,,Aug 2014
458,‘Critical moments’ and identity in elite Premier League Academy football,https://pureportal.coventry.ac.uk/en/publications/critical-moments-and-identity-in-elite-premier-league-academy-foo,"O'Halloran, L.",https://pureportal.coventry.ac.uk/en/persons/lisa-ohalloran,2014
459,Addressing a critique of the TEASI framework for invasive species risk assessment,https://pureportal.coventry.ac.uk/en/publications/addressing-a-critique-of-the-teasi-framework-for-invasive-species,"Dehnen-Schmutz, K.",https://pureportal.coventry.ac.uk/en/persons/katharina-dehnen-schmutz,Nov 2013
460,An investigation of volatile organic compounds from the saliva of healthy individuals using headspace-trap/GC-MS,https://pureportal.coventry.ac.uk/en/publications/an-investigation-of-volatile-organic-compounds-from-the-saliva-of-2,,,18 Jul 2013
461,A novel approach to oral iron delivery using ferrous sulphate loaded solid lipid nanoparticles,https://pureportal.coventry.ac.uk/en/publications/a-novel-approach-to-oral-iron-delivery-using-ferrous-sulphate-loa,"Farnaud, S.",https://pureportal.coventry.ac.uk/en/persons/sebastien-farnaud,18 Nov 2013
462,"A Self-management Programme of Activity, Coping and Education (SPACE) for COPD: A randomised non-inferiority trial in a pulmonary rehabilitation population.",https://pureportal.coventry.ac.uk/en/publications/a-self-management-programme-of-activity-coping-and-education-spac,"Horton, E.",https://pureportal.coventry.ac.uk/en/persons/elizabeth-horton,2013
463,"Assessment of the Ergogenic Effect of Caffeine Supplementation on Mood, Anticipation Timing and Muscular Strength in Older Adults",https://pureportal.coventry.ac.uk/en/publications/assessment-of-the-ergogenic-effect-of-caffeine-supplementation-on,"Tallis, J.",https://pureportal.coventry.ac.uk/en/persons/jason-tallis,29 Aug 2013
464,Cardiovascular adaptation in people with multiple sclerosis following a 12 week exercise programme suggest deconditioning rather than autonomic dysfunction caused by the disease,https://pureportal.coventry.ac.uk/en/publications/cardiovascular-adaptation-in-people-with-multiple-sclerosis-follo,,,2013
465,Compromised Energy and Macronutrient Intake of Ultra-endurance Runners During a Multi-stage Ultra-marathon Conducted in a Hot Ambient Environment,https://pureportal.coventry.ac.uk/en/publications/compromised-energy-and-macronutrient-intake-of-ultra-endurance-ru-2,"Hankey, J.",https://pureportal.coventry.ac.uk/en/persons/jo-hankey,2013
466,Critical moments and identity in elite Premier League Academy football,https://pureportal.coventry.ac.uk/en/publications/critical-moments-and-identity-in-elite-premier-league-academy-foo-2,"O'Halloran, L.",https://pureportal.coventry.ac.uk/en/persons/lisa-ohalloran,2013
467,Employing descriptive phenomenology within sport psychology research: Challenges encountered and resolutions explored,https://pureportal.coventry.ac.uk/en/publications/employing-descriptive-phenomenology-within-sport-psychology-resea,"O'Halloran, L.",https://pureportal.coventry.ac.uk/en/persons/lisa-ohalloran,2013
468,Evaluation of skeletal muscle satellite cell activity in rodent models depicting muscle hypertrophy and atrophy,https://pureportal.coventry.ac.uk/en/publications/evaluation-of-skeletal-muscle-satellite-cell-activity-in-rodent-m,"Sidique, I.",https://pureportal.coventry.ac.uk/en/persons/idris-sidique-adair,May 2013
469,High-polyphenol chocolate reduces endothelial dysfunction and oxidative stress during acute transient hyperglycaemia in Type 2 diabetes: A pilot randomized controlled trial.,https://pureportal.coventry.ac.uk/en/publications/high-polyphenol-chocolate-reduces-endothelial-dysfunction-and-oxi,,,Apr 2013
470,Kinematic adaptations in sprint acceleration performances without and with the constraint of holding a field hockey stick,https://pureportal.coventry.ac.uk/en/publications/kinematic-adaptations-in-sprint-acceleration-performances-without,"Wdowski, M.",https://pureportal.coventry.ac.uk/en/persons/maximilian-wdowski,Jun 2013
471,Modulation of the gelation efficiency of fibrillar and spherical aggregates by means of thiolation,https://pureportal.coventry.ac.uk/en/publications/modulation-of-the-gelation-efficiency-of-fibrillar-and-spherical-,"Munialo, C. D.",https://pureportal.coventry.ac.uk/en/persons/claire-munialo,27 Nov 2013
472,Motor impairment and its relationship to fitness in children.,https://pureportal.coventry.ac.uk/en/publications/motor-impairment-and-its-relationship-to-fitness-in-children,,,2013
473,Multiple pathways mediate the sex-peptide-regulated switch in female Drosophila reproductive behaviours.,https://pureportal.coventry.ac.uk/en/publications/multiple-pathways-mediate-the-sex-peptide-regulated-switch-in-fem,,,22 Nov 2013
474,Oxidation of tertiary amine-derivatized surfaces to control protein adhesion,https://pureportal.coventry.ac.uk/en/publications/oxidation-of-tertiary-amine-derivatized-surfaces-to-control-prote,"Dobrzanska, D. A.",https://pureportal.coventry.ac.uk/en/persons/dorota-dobrzanska,12 Feb 2013
475,Palmitoylation and the trafficking of peripheral membrane proteins,https://pureportal.coventry.ac.uk/en/publications/palmitoylation-and-the-trafficking-of-peripheral-membrane-protein,"Greaves, J.",https://pureportal.coventry.ac.uk/en/persons/jennifer-greaves,29 Jan 2013
476,Performance Enhancement Drugs and Sports Supplements for Resistance Training,https://pureportal.coventry.ac.uk/en/publications/performance-enhancement-drugs-and-sports-supplements-for-resistan-2,"Guimarães-Ferreira, L.",https://pureportal.coventry.ac.uk/en/persons/lucas-guimaraes-ferreira-2,Aug 2013
477,"Polymorphic variation within the ADAMTS2, ADAMTS14, ADAMTS5, ADAM12 and TIMP2 genes and the risk of Achilles tendon pathology: a genetic association study",https://pureportal.coventry.ac.uk/en/publications/polymorphic-variation-within-the-adamts2-adamts14-adamts5-adam12-,"Raleigh, S. M.",https://pureportal.coventry.ac.uk/en/persons/stuart-raleigh,Nov 2013
478,Salivary antimicrobial protein responses during multistage ultramarathon competition conducted in hot environmental conditions,https://pureportal.coventry.ac.uk/en/publications/salivary-antimicrobial-protein-responses-during-multistage-ultram-2,"Hankey, J.",https://pureportal.coventry.ac.uk/en/persons/jo-hankey,2013
479,"Structure, function and regulation of versican: the most abundant type of proteoglycan in the extracellular matrix",https://pureportal.coventry.ac.uk/en/publications/structure-function-and-regulation-of-versican-the-most-abundant-t,"Burke, B.",https://pureportal.coventry.ac.uk/en/persons/bernie-burke,2013
480,The relationship between growth stages and aroma composition of lemon basil Ocimum citriodorum Vis,https://pureportal.coventry.ac.uk/en/publications/the-relationship-between-growth-stages-and-aroma-composition-of-l-2,,,7 Dec 2013
481,Water and sodium intake habits and status of ultra-endurance runners during a multi-stage ultra-marathon conducted in a hot ambient environment: an observational field based study,https://pureportal.coventry.ac.uk/en/publications/water-and-sodium-intake-habits-and-status-of-ultra-endurance-runn-2,"Lee, B.",https://pureportal.coventry.ac.uk/en/persons/ben-lee,2013
482,Water soluble bis(indolenine)squaraine salts for use as fluorescent protein-sensitive probes,https://pureportal.coventry.ac.uk/en/publications/water-soluble-bisindoleninesquaraine-salts-for-use-as-fluorescent-2,,,2013
483,Water soluble squaraine dyes for use as colorimetric stains in gel electrophoresis. Part 2,https://pureportal.coventry.ac.uk/en/publications/water-soluble-squaraine-dyes-for-use-as-colorimetric-stains-in-ge-2,,,2013
484,Weight gain in British first year university students: Is the ‘Freshman 15’only an American phenomenon?,https://pureportal.coventry.ac.uk/en/publications/weight-gain-in-british-first-year-university-students-is-the-fres,,,1 Jan 2013
485,Writing lab reports and projects in sport and exercise science,https://pureportal.coventry.ac.uk/en/publications/writing-lab-reports-and-projects-in-sport-and-exercise-science,"Price, M.",https://pureportal.coventry.ac.uk/en/persons/mike-price,Jan 2013
486,3 days of heat acclimation attenuates the monocyte HSP70 response following acute hypoxic exposure in humans,https://pureportal.coventry.ac.uk/en/publications/3-days-of-heat-acclimation-attenuates-the-monocyte-hsp70-response-3,"Lee, B.",https://pureportal.coventry.ac.uk/en/persons/ben-lee,2012
487,Alterations in peripheral muscle contractile characteristics following high and low intensity bouts of exercise.,https://pureportal.coventry.ac.uk/en/publications/alterations-in-peripheral-muscle-contractile-characteristics-foll,,,2012
488,A review of the current nutritional guidelines for diabetes,https://pureportal.coventry.ac.uk/en/publications/a-review-of-the-current-nutritional-guidelines-for-diabetes,,,1 May 2012
489,"Building confidence, competence and collaboration using technology enhanced learning resources",https://pureportal.coventry.ac.uk/en/publications/building-confidence-competence-and-collaboration-using-technology,,,20 Aug 2012
490,Cell cycle- and DNA repair pathway-specific effects of apoptosis on tumor suppression,https://pureportal.coventry.ac.uk/en/publications/cell-cycle-and-dna-repair-pathway-specific-effects-of-apoptosis-o,"Foster, S.",https://pureportal.coventry.ac.uk/en/persons/steven-foster,19 Jun 2012
491,Critical moments in elite Premiership football:  Who do you think you are?,https://pureportal.coventry.ac.uk/en/publications/critical-moments-in-elite-premiership-football-who-do-you-think-y,"O'Halloran, L.",https://pureportal.coventry.ac.uk/en/persons/lisa-ohalloran,2012
492,EN2: A Candidate Antigen for the Development of Targeted Therapies in Breast Cancer,https://pureportal.coventry.ac.uk/en/publications/en2-a-candidate-antigen-for-the-development-of-targeted-therapies-2,"Bokaee, S.",https://pureportal.coventry.ac.uk/en/persons/shadi-bokaee,1 Nov 2012
493,"Folliculin interacts with p0071 (plakophilin-4) and deficiency is associated with disordered RhoA signalling, epithelial polarization and cytokinesis",https://pureportal.coventry.ac.uk/en/publications/folliculin-interacts-with-p0071-plakophilin-4-and-deficiency-is-a,"Reiman, A.",https://pureportal.coventry.ac.uk/en/persons/anne-reiman,15 Dec 2012
494,Gene Variants that Predispose to Achilles tendon injuries: An update on Recent Advances,https://pureportal.coventry.ac.uk/en/publications/gene-variants-that-predispose-to-achilles-tendon-injuries-an-upda,"Raleigh, S. M.",https://pureportal.coventry.ac.uk/en/persons/stuart-raleigh,Jan 2012
495,Matrix metalloproteinase genes on chromosome 11q22 and the risk of anterior cruciate ligament (ACL) rupture,https://pureportal.coventry.ac.uk/en/publications/matrix-metalloproteinase-genes-on-chromosome-11q22-and-the-risk-o,"Raleigh, S. M.",https://pureportal.coventry.ac.uk/en/persons/stuart-raleigh,Aug 2012
496,Methods of Monitoring Training in Adolescent Soccer Players,https://pureportal.coventry.ac.uk/en/publications/methods-of-monitoring-training-in-adolescent-soccer-players-2,"Noon, M.",https://pureportal.coventry.ac.uk/en/persons/mark-noon,2012
497,Modulation of regulatory T cells by targeting the NFAT-FOXP3 protein : protein interaction,https://pureportal.coventry.ac.uk/en/publications/modulation-of-regulatory-t-cells-by-targeting-the-nfat-foxp3-prot-2,"Bokaee, S.",https://pureportal.coventry.ac.uk/en/persons/shadi-bokaee,2012
498,One-step deposition of Au nanoparticles onto chemically modified ceramic hollow spheres via self-assembly,https://pureportal.coventry.ac.uk/en/publications/one-step-deposition-of-au-nanoparticles-onto-chemically-modified-,,,Jan 2012
499,Plant health challenges for a sustainable land use and rural economy,https://pureportal.coventry.ac.uk/en/publications/plant-health-challenges-for-a-sustainable-land-use-and-rural-econ,"Dehnen-Schmutz, K.",https://pureportal.coventry.ac.uk/en/persons/katharina-dehnen-schmutz,2012
500,"Simultaneous identification of five marine fish pathogens belonging to the genera Tenacibaculum, Vibrio, Photobacterium and Pseudomonas by reverse line blot hybridization",https://pureportal.coventry.ac.uk/en/publications/simultaneous-identification-of-five-marine-fish-pathogens-belongi,,,12 Jan 2012
501,Sleep habits and recovery quality of ultra-endurance runners during a multi-stage ultra-marathon competition in the heat,https://pureportal.coventry.ac.uk/en/publications/sleep-habits-and-recovery-quality-of-ultra-endurance-runners-duri-2,"Lee, B.",https://pureportal.coventry.ac.uk/en/persons/ben-lee,2012
502,TEASIng apart alien species risk assessments: A framework for best practices,https://pureportal.coventry.ac.uk/en/publications/teasing-apart-alien-species-risk-assessments-a-framework-for-best,"Dehnen-Schmutz, K.",https://pureportal.coventry.ac.uk/en/persons/katharina-dehnen-schmutz,Dec 2012
503,The effect of physiological concentrations of caffeine on the power output of maximally and submaximally stimulated mouse EDL (fast) and soleus (slow) muscle,https://pureportal.coventry.ac.uk/en/publications/the-effect-of-physiological-concentrations-of-caffeine-on-the-pow-2,"Tallis, J.",https://pureportal.coventry.ac.uk/en/persons/jason-tallis,1 Jan 2012
504,The 'lived experience' of elite 'home-grown' footballers in a Premier League Academy: A descriptive phenomenological exploration,https://pureportal.coventry.ac.uk/en/publications/the-lived-experience-of-elite-home-grown-footballers-in-a-premier,"O'Halloran, L.",https://pureportal.coventry.ac.uk/en/persons/lisa-ohalloran,2012
505,The nuclear factor kappa B signaling pathway: integrating metabolism with inflammation,https://pureportal.coventry.ac.uk/en/publications/the-nuclear-factor-kappa-b-signaling-pathway-integrating-metaboli,,,1 Nov 2012
506,The Population Pharmacokinetics of R and S-Warfarin: Effect of Genetic and Clinical Factors,https://pureportal.coventry.ac.uk/en/publications/the-population-pharmacokinetics-of-r-and-s-warfarin-effect-of-gen-2,,,Jan 2012
507,Birt Hogg-Dubé syndrome-associated FLCN mutations disrupt protein stability,https://pureportal.coventry.ac.uk/en/publications/birt-hogg-dub%C3%A9-syndrome-associated-flcn-mutations-disrupt-protein,"Reiman, A.",https://pureportal.coventry.ac.uk/en/persons/anne-reiman,Aug 2011
508,Chlamydia psittaci infection in canaries heavily infested by Dermanyssus gallinae,https://pureportal.coventry.ac.uk/en/publications/chlamydia-psittaci-infection-in-canaries-heavily-infested-by-derm,,,1 Jan 2011
509,"Daily torpor reduces mass and changes stress and power output of soleus and EDL muscles in the Djungarian hamster, Phodopus sungorus.",https://pureportal.coventry.ac.uk/en/publications/daily-torpor-reduces-mass-and-changes-stress-and-power-output-of--2,"James, R. S.",https://pureportal.coventry.ac.uk/en/persons/rob-james,1 Sep 2011
510,Dermanyssus gallinae in layer farms in Kosovo: A high risk for salmonella prevalence,https://pureportal.coventry.ac.uk/en/publications/dermanyssus-gallinae-in-layer-farms-in-kosovo-a-high-risk-for-sal,,,15 Jul 2011
511,Determining non-invasiveness in ornamental plants to build green lists,https://pureportal.coventry.ac.uk/en/publications/determining-non-invasiveness-in-ornamental-plants-to-build-green-,"Dehnen-Schmutz, K.",https://pureportal.coventry.ac.uk/en/persons/katharina-dehnen-schmutz,Dec 2011
512,Diabetes UK evidence-based nutrition guidelines for the prevention and management of diabetes,https://pureportal.coventry.ac.uk/en/publications/diabetes-uk-evidence-based-nutrition-guidelines-for-the-preventio,,,Nov 2011
513,ELAV-Mediated 3′-End Processing of ewg Transcripts Is Evolutionarily Conserved Despite Sequence Degeneration of the ELAV-Binding Site,https://pureportal.coventry.ac.uk/en/publications/elav-mediated-3-end-processing-of-ewg-transcripts-is-evolutionari,,,29 Jul 2011
514,EN2: A candidate antigen for the development of targeted therapies in ovarian cancer.,https://pureportal.coventry.ac.uk/en/publications/en2-a-candidate-antigen-for-the-development-of-targeted-therapies,"Bokaee, S.",https://pureportal.coventry.ac.uk/en/persons/shadi-bokaee,20 May 2011
515,Endoplasmic reticulum localization of DHHC palmitoyltransferases mediated by lysine-based sorting signals,https://pureportal.coventry.ac.uk/en/publications/endoplasmic-reticulum-localization-of-dhhc-palmitoyltransferases-,"Greaves, J.",https://pureportal.coventry.ac.uk/en/persons/jennifer-greaves,11 Nov 2011
516,Functional interplay of the Mre11 nuclease and Ku in the response to replication-associated DNA damage,https://pureportal.coventry.ac.uk/en/publications/functional-interplay-of-the-mre11-nuclease-and-ku-in-the-response,"Foster, S.",https://pureportal.coventry.ac.uk/en/persons/steven-foster,Nov 2011
517,Fundamental Movement Skill Mastery in British Primary School children: Differences due to gender and school year,https://pureportal.coventry.ac.uk/en/publications/fundamental-movement-skill-mastery-in-british-primary-school-chil-2,"Oxford, S.",https://pureportal.coventry.ac.uk/en/persons/sam-oxford,8 Sep 2011
518,Improvements in functional movement screen scores across 6 months of in-season strength and conditioning training in elite academy football players,https://pureportal.coventry.ac.uk/en/publications/improvements-in-functional-movement-screen-scores-across-6-months-2,"Noon, M.",https://pureportal.coventry.ac.uk/en/persons/mark-noon,2011
519,Injuries in Sport among Children and Adolescents,https://pureportal.coventry.ac.uk/en/publications/injuries-in-sport-among-children-and-adolescents,"Leddington Wright, S.",https://pureportal.coventry.ac.uk/en/persons/sheila-leddington-wright,2011
520,Maintaining hamstrings to quadriceps ratio in elite academy soccer players through a strength and conditioning programme,https://pureportal.coventry.ac.uk/en/publications/maintaining-hamstrings-to-quadriceps-ratio-in-elite-academy-socce-2,"Noon, M.",https://pureportal.coventry.ac.uk/en/persons/mark-noon,2011
521,Monocyte-derived macrophages matured under prolonged hypoxia transcriptionally up-regulate HIF-1α mRNA,https://pureportal.coventry.ac.uk/en/publications/monocyte-derived-macrophages-matured-under-prolonged-hypoxia-tran,"Burke, B.",https://pureportal.coventry.ac.uk/en/persons/bernie-burke,Jul 2011
522,Parasitism in egg production systems: The role of the red mite (Dermanyssus gallinae),https://pureportal.coventry.ac.uk/en/publications/parasitism-in-egg-production-systems-the-role-of-the-red-mite-der,,,1 Jan 2011
